Sheet: Reporte de Distribuciones UDIS
B2: REPORTE DE DISTRIBUCIONES
C3: Emisión: | D3: rdNomEmision | K3: Fecha Cálculo: | L3: rdFechaCalculo
B5: Flujo de Cobranza al Fideicomiso | H5: Reporte de Distribición
D6: Depositado | H6: 1 | L6: Saldo de efectivo
C7: Inicial | D7: rdImpDepositoInicial | I7: Saldo en Caja del Fideicomiso | L7: =+R[4]C[-8] -> 
C8: COBRANZA BIMESTRdE 1 | D8: rdImpDeposito1 | I8: Intereses devengados Inversiones TRB | L8: =+R[-1]C+RC[-2] -> 
C9: COBRANZA BIMESTRE 2 | D9: rdImpDeposito2 | I9: Honorarios Fiduciario | J9: rdImpHonoFid
C10: COBRANZA BIMESTRE 3 | D10: rdImpDeposito3 | I10: Honorarios Representante Común | J10: rdImpHonoRepComun
D11: =SUM(R[-4]C:R[-1]C)+R[-1]C[2] ->  | I11: Bolsa Mexicana de Valores, S.A. C.V. | J11: rdImpHonoBmv
I12: CNBV | J12: rdImpHonoCnvb
B13: Saldo Final Cartera Reporte AMR648 | I13: ISR | J13: rdImpHonoIsr
I14: Auditores Externos | J14: rdImpHonoAuditXt
I15: Auditores Externos (Revisión Expendientes) | J15: rdImpHonoAuditXtRe
B16: Estadística de la Morosidad de la Cartera | I16: Honorarios Legales | J16: rdImpHonoLegales
C17: Cuentas | D17: % Cuentas | E17: Saldo | I17: Publicaciones | J17: rdImpHonoPublicaciones
B18: Extensión | C18: rdCuentasExt | D18: rdPjeCuentasExt | E18: rdSalCuentasExt | I18: ISR
B19: 30-59 | C19: rdCuentas3059 | D19: rdPjeCuentas3059 | E19: rdSalCuentas3059 | I19: Total Gastos Semestrales | K19: =SUM(R[-10]C[-1]:R[-1]C[-1]) ->  | L19: =+R[-11]C-RC[-1] -> 
B20: 60-89 | C20: rdCuentas6089 | D20: rdPjeCuentas6089 | E20: rdSalCuentas6089 | I20: Pagos a los Tenedores:
B21: 90-119 | C21: rdCuentas90119 | D21: rdPjeCuentas90119 | E21: rdSalCuentas90119 | H21: 2 | I21: Intereses a los Tenedores | K21: =+R[19]C[-7]*R[14]C[-8] -> 
B22: 120-149 | C22: rdCuentas120149 | D22: rdPjeCuentas120149 | E22: rdSalCuentas120149 | H22: 3 | I22: Amortización Anticipada de Principal | K22: =MAX(0,MIN(R[-3]C[1]-R[-1]C)) -> 
B23: 150-179 | C23: rdCuentas150179 | D23: rdPjeCuentas150179 | E23: rdSalCuentas150179 | I23: Total a distribuir a los tenedores | K23: =+R[-1]C+R[-2]C -> 
B24: 180 and over | C24: rdCuentas180 | D24: rdPjeCuentas180 | E24: rdSalCuentas180 | F24: =+RC[-1] -> 0 | H24: 4 | I24: Monto Remanente | L24: =+R[-5]C-R[-3]C[-1]-R[-2]C[-1] -> 0
B25: TOTAL | C25: =SUM(R[-7]C:R[-1]C) ->  | D25: =+RC[-1]/R13C5 ->  | E25: =SUM(R[-7]C:R[-1]C) ->  | F25: =SUM(R[-7]C:R[-1]C) -> 0
I26: Otros Conceptos:
B27: Saldos Cartera a deducir de Cómputo | F27: =+R[-2]C -> 0
K28: UDIS | L28: Pesos
B29: Saldo Vigente fines Fideicomiso | F29: =+R[-16]C-R[-2]C -> 1434780186.8699999 | I29: Amortización Anticipada de Principal | K29: =+RC[1]/R[6]C[-8] ->  | L29: =+R[-7]C[-1] -> 
I30: Saldo Certificados después del pago de cupón | K30: =+R[8]C[-7]-(R[-1]C[1]/R[5]C[-8]) ->  | L30: =+RC[-1]*R[5]C[-9] -> 
B31: Cálculo del Pago A CEDEVIS 05U | I31: Saldo Cartera Vigente y Activos | K31: =+RC[1]/R[4]C[-8] ->  | L31: =+R[35]C[-7] -> 
B32: Periodo | C32: Fechas Periodo de Cupón | D32: Dias | I32: Porcentaje de Certificados a Activos Vigentes | L32: =+R[-2]C/R[-1]C -> 
B33: Fecha Inicio de Periodo Ints | C33: rdFechaInicio | I33: Monto de Distribución a la Constancia | L33: =+R[29]C[-7] -> 
B34: Fecha de Pago del periodo | C34: rdFechaPago | D34: =+RC[-1]-R[-1]C[-1] ->  | I34: Monto de Retención en el Fideicomiso | L34: =+R[30]C[-7] -> 
B35: T.C UDI A la Fecha de Pago | C35: rdTasaUdi
B36: Cálculo del Cupón
D37: UDIS | E37: Pesos | I37: CEDEVIS
B38: (Si) Saldo Insoluto Inicio Periodo CEDEVIS | D38: rdSaldoInsolutoInicio | E38: =+RC[-1]*R35C3 ->  | I38: Inicio: | J38: Udis | K38: Pesos
B39: (TB) Tasa | D39: rdTasa | I39: Valor Nominal Adjustado Emisión:
B40: (IDi) Intereses | D40: =+R[-2]C*R[-1]C/360*R[-6]C ->  | E40: =+RC[-1]*R35C3 ->  | I40: VNA Inicio del período | J40: =+R[-2]C[-6] ->  | K40: =+R[-2]C[-6] -> 
B41: (Nfi) Periodo que se está pagando | I41: Amortización Anticipada | J41: =+R[2]C[-6] ->  | K41: =+R[2]C[-6] -> 
B42: Total de Pagos semestrales del CEDEVI | D42: 14 | I42: VNA Nuevo | J42: =+R[-2]C-R[-1]C -> 309357628.56503272
B43: Monto de Amortización Anticipada | D43: =+R[-14]C[7] ->  | E43: =+RC[-1]*R35C3 -> 
B44: Pago Total a CEDEVIS | D44: =+R[-1]C+R[-4]C ->  | E44: =+RC[-1]*R35C3 ->  | I44: A partir del: | J44: =+R[-10]C[-7] -> 
B45: (SIPB) Saldo insoluto de principal CEDEVIS | D45: =+R[-7]C-R[-2]C ->  | E45: =+RC[-1]*R35C3 ->  | I45: VNA Nuevo | J45: =+R[-5]C-R[-4]C ->  | K45: =+RC[-6] -> 
B46: % Del valor nominal CEDEVIS | D46: =+R[-1]C/R[-8]C ->  | E46: =+R[-1]C/R[-8]C -> 0.94683769384683214 | I46: Total Títulos | J46: rdTotTitulos
B47: Cálculo Distribución a Constancia | I47: VNA x Título | J47: =+R[-2]C/R[-1]C -> rdVnaTitulo
D48: UDIS | E48: Pesos
B49: SIPCB (Saldo Insoluto Cedevi) | D49: =+RC[1]/R[-14]C[-1] -> 309357628.56503266 | E49: =+R[-19]C[7] -> 1130838249.7617631
B50: CHV (Cartera Hip. Vigente) | D50: =+RC[1]/R35C3 -> 392505467.70566607 | E50: =+R[-21]C[1] -> 1434780186.8699999 | J50: Fecha | K50: Saldo Insoluto Principal
B51: MR (Monto Remanente) | D51: =+RC[1]/R35C3 -> 0 | E51: =+R[-27]C[7] -> 0 | K51: de los Certificados | L51: %
B52: Subordinación | D52: =1-+R[-3]C/R[-2]C -> 0.21183867737349515 | E52: =1-(R[-22]C[7]/(+R[-2]C)) -> 0.21183867737349504 | J52: 38303 | K52: 345761100 | L52: 1
B53: Nivel del Gatillo de Evento de Retención | E53: 0.23 | J53: 38492 | K53: 328939124.63451242 | L53: 0.95134798169751433
B54: Evento de Retención | E54: =IF(R[-2]C<R53C5,"SI","NO") -> SI | J54: 38677 | K54: 309229774.05024737 | L54: 0.8943451824113452
B55: Saldo teórico para Colateralización 23% | D55: =+RC[1]/R[-20]C[-1] -> 401763153.98056191 | E55: =(+R[-10]C[-1]*R[-20]C[-2])/(1-R[-2]C) -> 1468621103.5867052
B58: Saldo Cartera Vigente | C58: + | D58: =+RC[1]/R35C3 ->  | E58: =+R[-8]C -> 
B59: Monto Remanente | C59: + | D59: =+RC[1]/R35C3 ->  | E59: =+R[-35]C[7] -> 
B60: Activos Totales | D60: =+RC[1]/R35C3 ->  | E60: =+R[-1]C+R[-2]C -> 
B62: Importe a repartir a la Constancia | D62: =+RC[1]/R[-27]C[-1] ->  | E62: =MAX(0,(R[-12]C/R[-27]C[-2])+R[-11]C-R[-7]C) -> 
B64: Recursos diponibles | C64: + | D64: =+RC[1]/R35C3 ->  | E64: =+R[-13]C-R[-2]C -> 
B65: Saldo Cartera Vigente | C65: + | D65: =+RC[1]/R35C3 ->  | E65: =+R[-15]C -> 
B66: Saldo Final Colateral | C66: = | D66: =+RC[1]/R35C3 ->  | E66: =+R[-1]C+R[-2]C -> 
B68: Colateralización final | D68: =1-(+R[-23]C/R[-2]C) ->  | E68: =1-(R[-38]C[7]/(R[-2]C)) -> 
E69: =IF(R[-1]C<R53C5,"SI","NO") -> SI
B70: Colateral Faltante | E70: =IF(+R[-15]C-R[-4]C>0,+R[-15]C-R[-4]C,0) -> 33840916.716705322